{
  "$schema": "https://json-schema.org/draft/2020-12/schema",
  "properties": {
    "guaranteed": {
      "title": "guaranteed",
      "$ref": "Hiro-Reward"
    },
    "weighted": {
      "title": "weighted",
      "type": "array",
      "items": {
        "$ref": "Hiro-Reward"
      }
    },
    "max_rolls": {
      "type": "number",
      "title": "max_rolls",
      "minimum": 0
    },
    "total_weight": {
      "type": "number",
      "title": "total_weight",
      "minimum": 0
    }
  },
  "type": "object"
}
