{
  "guaranteed": {
    "items": [
      {
        "key": "item1",
        "value": {
          "max": 2,
          "min": 2,
          "multiple": 1
        }
      },
      {
        "key": "item2",
        "value": {
          "max": 100,
          "min": 10,
          "multiple": 5
        }
      }
    ]
  },
  "weighted": [
    {
      "currencies": [
        {
          "key": "currency1",
          "value": {
            "max": 200,
            "min": 100
          }
        }
      ],
      "weight": 5
    }
  ],
  "max_rolls": 2,
  "total_weight": 5
}
